{
  "id": 1467,
  "name": "dynamax-crystal-cet681",
  "fling_power": null,
  "fling_effect": null,
  "attributes": [],
  "category": {
    "name": "dynamax-crystals",
    "url": "/api/v2/item-category/49/"
  },
  "effect_entries": [],
  "flavor_text_entries": [
    {
      "text": "つかった　ひに　ワイルドエリアの\nみはりとうのダイすあな　から\n[VAR (0000)]が　あらわれる。",
      "version_group": {
        "name": "sword-shield",
        "url": "/api/v2/version-group/20/"
      },
      "language": {
        "name": "ja-hrkt",
        "url": "/api/v2/language/1/"
      }
    },
    {
      "text": "사용한 당일에만 와일드에리어에 있는\n감시탑의 다이맥스굴에서\n[VAR (0000)][VAR (0003)] 나타난다.",
      "version_group": {
        "name": "sword-shield",
        "url": "/api/v2/version-group/20/"
      },
      "language": {
        "name": "ko",
        "url": "/api/v2/language/3/"
      }
    },
    {
      "text": "使用後的當天，\n[VAR (0000)]會出現在\n曠野地帶的瞭望塔巨巢。",
      "version_group": {
        "name": "sword-shield",
        "url": "/api/v2/version-group/20/"
      },
      "language": {
        "name": "zh-hant",
        "url": "/api/v2/language/4/"
      }
    },
    {
      "text": "Un objet faisant apparaître un [VAR (0000)]\ndans l’antre géant de la Tour en ruines\ndes Terres Sauvages jusqu’à la fin de la journée.",
      "version_group": {
        "name": "sword-shield",
        "url": "/api/v2/version-group/20/"
      },
      "language": {
        "name": "fr",
        "url": "/api/v2/language/5/"
      }
    },
    {
      "text": "Dieses Item bewirkt, dass im Wachturm-Nest in der\nNaturzone ein [VAR (0000)] bis zum Ende des Tages\nerscheint, an dem das Item eingesetzt wurde.",
      "version_group": {
        "name": "sword-shield",
        "url": "/api/v2/version-group/20/"
      },
      "language": {
        "name": "de",
        "url": "/api/v2/language/6/"
      }
    },
    {
      "text": "Posibilita la aparición de [VAR (0000)] en el nido\nDinamax de la Atalaya del Área Silvestre hasta finalizar\nel día en que se ha usado.",
      "version_group": {
        "name": "sword-shield",
        "url": "/api/v2/version-group/20/"
      },
      "language": {
        "name": "es",
        "url": "/api/v2/language/7/"
      }
    },
    {
      "text": "Strumento che fa apparire [VAR (0000)] nella\ndynatana della Torre Diroccata, nelle Terre Selvagge,\nfino alla fine del giorno in cui viene usato.",
      "version_group": {
        "name": "sword-shield",
        "url": "/api/v2/version-group/20/"
      },
      "language": {
        "name": "it",
        "url": "/api/v2/language/8/"
      }
    },
    {
      "text": "An item that causes [VAR (0000)] to appear from\nthe Watchtower Lair in the Wild Area until the end of\nthe day.",
      "version_group": {
        "name": "sword-shield",
        "url": "/api/v2/version-group/20/"
      },
      "language": {
        "name": "en",
        "url": "/api/v2/language/9/"
      }
    },
    {
      "text": "使った　日に　ワイルドエリアの\n見張り塔のダイ巣穴　から\n[VAR (0000)]が　現れる。",
      "version_group": {
        "name": "sword-shield",
        "url": "/api/v2/version-group/20/"
      },
      "language": {
        "name": "ja",
        "url": "/api/v2/language/11/"
      }
    },
    {
      "text": "使用后的当天，\n旷野地带的瞭望塔巨巢中\n会出现[VAR (0000)]。",
      "version_group": {
        "name": "sword-shield",
        "url": "/api/v2/version-group/20/"
      },
      "language": {
        "name": "zh-hans",
        "url": "/api/v2/language/12/"
      }
    },
    {
      "text": "Posibilita la aparición de [VAR (0000)] en el nido\nDinamax de la Atalaya del Área Silvestre hasta finalizar\nel día en que se ha usado.",
      "version_group": {
        "name": "sword-shield",
        "url": "/api/v2/version-group/20/"
      },
      "language": {
        "name": "es-419",
        "url": "/api/v2/language/14/"
      }
    }
  ],
  "game_indices": [
    {
      "game_index": 1416,
      "generation": {
        "name": "generation-viii",
        "url": "/api/v2/generation/8/"
      }
    },
    {
      "game_index": 1416,
      "generation": {
        "name": "generation-ix",
        "url": "/api/v2/generation/9/"
      }
    }
  ],
  "prices": [],
  "names": [
    {
      "name": "★Cet681",
      "language": {
        "name": "ja-hrkt",
        "url": "/api/v2/language/1/"
      }
    },
    {
      "name": "★Cet681",
      "language": {
        "name": "ko",
        "url": "/api/v2/language/3/"
      }
    },
    {
      "name": "★Cet681",
      "language": {
        "name": "zh-hant",
        "url": "/api/v2/language/4/"
      }
    },
    {
      "name": "★Cet681",
      "language": {
        "name": "fr",
        "url": "/api/v2/language/5/"
      }
    },
    {
      "name": "★Cet681",
      "language": {
        "name": "de",
        "url": "/api/v2/language/6/"
      }
    },
    {
      "name": "★Cet681",
      "language": {
        "name": "es",
        "url": "/api/v2/language/7/"
      }
    },
    {
      "name": "★Cet681",
      "language": {
        "name": "it",
        "url": "/api/v2/language/8/"
      }
    },
    {
      "name": "★Cet681",
      "language": {
        "name": "en",
        "url": "/api/v2/language/9/"
      }
    },
    {
      "name": "★Cet681",
      "language": {
        "name": "ja",
        "url": "/api/v2/language/11/"
      }
    },
    {
      "name": "★Cet681",
      "language": {
        "name": "zh-hans",
        "url": "/api/v2/language/12/"
      }
    },
    {
      "name": "★Cet681",
      "language": {
        "name": "es-419",
        "url": "/api/v2/language/14/"
      }
    }
  ],
  "held_by_pokemon": [],
  "sprites": {
    "default": "https://raw.githubusercontent.com/PokeAPI/sprites/master/sprites/items/dynamax-crystal-cet681.png"
  },
  "baby_trigger_for": null,
  "machines": []
}