{
  "id": 2065,
  "name": "plaid-tablecloth-y",
  "fling_power": null,
  "fling_effect": null,
  "attributes": [],
  "category": {
    "name": "picnic",
    "url": "/api/v2/item-category/55/"
  },
  "effect_entries": [],
  "flavor_text_entries": [],
  "game_indices": [
    {
      "game_index": 2366,
      "generation": {
        "name": "generation-ix",
        "url": "/api/v2/generation/9/"
      }
    }
  ],
  "prices": [],
  "names": [
    {
      "name": "きいろチェッククロス",
      "language": {
        "name": "ja-hrkt",
        "url": "/api/v2/language/1/"
      }
    },
    {
      "name": "옐로 체크 테이블보",
      "language": {
        "name": "ko",
        "url": "/api/v2/language/3/"
      }
    },
    {
      "name": "黃色格子桌巾",
      "language": {
        "name": "zh-hant",
        "url": "/api/v2/language/4/"
      }
    },
    {
      "name": "Nappe Tartan Jaune",
      "language": {
        "name": "fr",
        "url": "/api/v2/language/5/"
      }
    },
    {
      "name": "Gelbkaro-Tischtuch",
      "language": {
        "name": "de",
        "url": "/api/v2/language/6/"
      }
    },
    {
      "name": "Mantel Cuadros Ámbar",
      "language": {
        "name": "es",
        "url": "/api/v2/language/7/"
      }
    },
    {
      "name": "Tovaglia a quadri gialla",
      "language": {
        "name": "it",
        "url": "/api/v2/language/8/"
      }
    },
    {
      "name": "Plaid Tablecloth (Y)",
      "language": {
        "name": "en",
        "url": "/api/v2/language/9/"
      }
    },
    {
      "name": "きいろチェッククロス",
      "language": {
        "name": "ja",
        "url": "/api/v2/language/11/"
      }
    },
    {
      "name": "黄色格子桌巾",
      "language": {
        "name": "zh-hans",
        "url": "/api/v2/language/12/"
      }
    }
  ],
  "held_by_pokemon": [],
  "sprites": {
    "default": "https://raw.githubusercontent.com/PokeAPI/sprites/master/sprites/items/plaid-tablecloth-y.png"
  },
  "baby_trigger_for": null,
  "machines": []
}