{
    "attributes": [],
    "baby_trigger_for": null,
    "category": {
        "name": "all-machines",
        "url": "/api/v2/item-category/37/"
    },
    "effect_entries": [],
    "flavor_text_entries": [],
    "fling_effect": null,
    "fling_power": null,
    "game_indices": [
        {
            "game_index": 2185,
            "generation": {
                "name": "generation-ix",
                "url": "/api/v2/generation/9/"
            }
        }
    ],
    "held_by_pokemon": [],
    "id": 1968,
    "machines": [
        {
            "machine": {
                "url": "/api/v2/machine/1940/"
            },
            "version_group": {
                "name": "scarlet-violet",
                "url": "/api/v2/version-group/25/"
            }
        },
        {
            "machine": {
                "url": "/api/v2/machine/2133/"
            },
            "version_group": {
                "name": "the-indigo-disk",
                "url": "/api/v2/version-group/27/"
            }
        },
        {
            "machine": {
                "url": "/api/v2/machine/2337/"
            },
            "version_group": {
                "name": "mega-dimension",
                "url": "/api/v2/version-group/31/"
            }
        }
    ],
    "name": "tm125",
    "names": [
        {
            "language": {
                "name": "ja-hrkt",
                "url": "/api/v2/language/1/"
            },
            "name": "\u308f\u3056\u30de\u30b7\u30f3\uff11\uff12\uff15"
        },
        {
            "language": {
                "name": "zh-hant",
                "url": "/api/v2/language/4/"
            },
            "name": "\u62db\u5f0f\u5b66\u4e60\u5668\uff11\uff12\uff15"
        },
        {
            "language": {
                "name": "fr",
                "url": "/api/v2/language/5/"
            },
            "name": "CT125"
        },
        {
            "language": {
                "name": "en",
                "url": "/api/v2/language/9/"
            },
            "name": "TM125"
        },
        {
            "language": {
                "name": "ja",
                "url": "/api/v2/language/11/"
            },
            "name": "\u308f\u3056\u30de\u30b7\u30f3\uff11\uff12\uff15"
        }
    ],
    "prices": [],
    "sprites": {
        "default": "https://raw.githubusercontent.com/PokeAPI/sprites/master/sprites/items/tm-normal.png"
    }
}