{
  "id": 2056,
  "name": "fire-pattern-cup",
  "fling_power": null,
  "fling_effect": null,
  "attributes": [],
  "category": {
    "name": "picnic",
    "url": "/api/v2/item-category/55/"
  },
  "effect_entries": [],
  "flavor_text_entries": [],
  "game_indices": [
    {
      "game_index": 2357,
      "generation": {
        "name": "generation-ix",
        "url": "/api/v2/generation/9/"
      }
    }
  ],
  "prices": [],
  "names": [
    {
      "name": "ファイヤーカップ",
      "language": {
        "name": "ja-hrkt",
        "url": "/api/v2/language/1/"
      }
    },
    {
      "name": "파이어 컵",
      "language": {
        "name": "ko",
        "url": "/api/v2/language/3/"
      }
    },
    {
      "name": "火焰水杯",
      "language": {
        "name": "zh-hant",
        "url": "/api/v2/language/4/"
      }
    },
    {
      "name": "Tasse à Flammes",
      "language": {
        "name": "fr",
        "url": "/api/v2/language/5/"
      }
    },
    {
      "name": "Flammen-Tasse",
      "language": {
        "name": "de",
        "url": "/api/v2/language/6/"
      }
    },
    {
      "name": "Taza Llamas",
      "language": {
        "name": "es",
        "url": "/api/v2/language/7/"
      }
    },
    {
      "name": "Tazza con fiamme",
      "language": {
        "name": "it",
        "url": "/api/v2/language/8/"
      }
    },
    {
      "name": "Fire Pattern Cup",
      "language": {
        "name": "en",
        "url": "/api/v2/language/9/"
      }
    },
    {
      "name": "ファイヤーカップ",
      "language": {
        "name": "ja",
        "url": "/api/v2/language/11/"
      }
    },
    {
      "name": "火焰水杯",
      "language": {
        "name": "zh-hans",
        "url": "/api/v2/language/12/"
      }
    }
  ],
  "held_by_pokemon": [],
  "sprites": {
    "default": "https://raw.githubusercontent.com/PokeAPI/sprites/master/sprites/items/fire-pattern-cup.png"
  },
  "baby_trigger_for": null,
  "machines": []
}