{
    "attributes": [],
    "baby_trigger_for": null,
    "category": {
        "name": "type-protection",
        "url": "/api/v2/item-category/7/"
    },
    "effect_entries": [],
    "flavor_text_entries": [],
    "fling_effect": null,
    "fling_power": 10,
    "game_indices": [],
    "held_by_pokemon": [],
    "id": 2279,
    "machines": [],
    "name": "roseli-berry",
    "names": [],
    "prices": [],
    "sprites": {
        "default": "https://raw.githubusercontent.com/PokeAPI/sprites/master/sprites/items/roseli-berry.png"
    }
}