{
  "id": 1250,
  "name": "tr62",
  "fling_power": 85,
  "fling_effect": null,
  "attributes": [],
  "category": {
    "name": "all-machines",
    "url": "/api/v2/item-category/37/"
  },
  "effect_entries": [],
  "flavor_text_entries": [
    {
      "text": "おおきな　くちから　しょうげきはを\nまきおこして　あいてを　こうげきする。",
      "version_group": {
        "name": "sword-shield",
        "url": "/api/v2/version-group/20/"
      },
      "language": {
        "name": "ja-hrkt",
        "url": "/api/v2/language/1/"
      }
    },
    {
      "text": "큰 입으로 충격파를\n일으켜서 상대를 공격한다.",
      "version_group": {
        "name": "sword-shield",
        "url": "/api/v2/version-group/20/"
      },
      "language": {
        "name": "ko",
        "url": "/api/v2/language/3/"
      }
    },
    {
      "text": "從張大的口中\n發射衝擊波攻擊對手。",
      "version_group": {
        "name": "sword-shield",
        "url": "/api/v2/version-group/20/"
      },
      "language": {
        "name": "zh-hant",
        "url": "/api/v2/language/4/"
      }
    },
    {
      "text": "Le lanceur ouvre la bouche pour envoyer\nune onde de choc qui frappe l’ennemi.",
      "version_group": {
        "name": "sword-shield",
        "url": "/api/v2/version-group/20/"
      },
      "language": {
        "name": "fr",
        "url": "/api/v2/language/5/"
      }
    },
    {
      "text": "Das Ziel wird mit einer Schockwelle angegriffen,\ndie aus dem offenen Maul des Anwenders kommt.",
      "version_group": {
        "name": "sword-shield",
        "url": "/api/v2/version-group/20/"
      },
      "language": {
        "name": "de",
        "url": "/api/v2/language/6/"
      }
    },
    {
      "text": "Abre mucho la boca y libera una onda de choque que\nataca al objetivo.",
      "version_group": {
        "name": "sword-shield",
        "url": "/api/v2/version-group/20/"
      },
      "language": {
        "name": "es",
        "url": "/api/v2/language/7/"
      }
    },
    {
      "text": "Chi la usa spalanca la bocca e genera un’onda\nd’urto che colpisce il bersaglio.",
      "version_group": {
        "name": "sword-shield",
        "url": "/api/v2/version-group/20/"
      },
      "language": {
        "name": "it",
        "url": "/api/v2/language/8/"
      }
    },
    {
      "text": "The target is attacked with a shock wave generated\nby the user’s gaping mouth.",
      "version_group": {
        "name": "sword-shield",
        "url": "/api/v2/version-group/20/"
      },
      "language": {
        "name": "en",
        "url": "/api/v2/language/9/"
      }
    },
    {
      "text": "大きな　口から　衝撃波を\nまきおこして　相手を　攻撃する。",
      "version_group": {
        "name": "sword-shield",
        "url": "/api/v2/version-group/20/"
      },
      "language": {
        "name": "ja",
        "url": "/api/v2/language/11/"
      }
    },
    {
      "text": "从大大的口中\n掀起冲击波攻击对手。",
      "version_group": {
        "name": "sword-shield",
        "url": "/api/v2/version-group/20/"
      },
      "language": {
        "name": "zh-hans",
        "url": "/api/v2/language/12/"
      }
    },
    {
      "text": "Abre mucho la boca y libera una onda de choque que\nataca al objetivo.",
      "version_group": {
        "name": "sword-shield",
        "url": "/api/v2/version-group/20/"
      },
      "language": {
        "name": "es-419",
        "url": "/api/v2/language/14/"
      }
    }
  ],
  "game_indices": [
    {
      "game_index": 1192,
      "generation": {
        "name": "generation-viii",
        "url": "/api/v2/generation/8/"
      }
    },
    {
      "game_index": 1192,
      "generation": {
        "name": "generation-ix",
        "url": "/api/v2/generation/9/"
      }
    }
  ],
  "prices": [],
  "names": [
    {
      "name": "わざレコード６２",
      "language": {
        "name": "ja-hrkt",
        "url": "/api/v2/language/1/"
      }
    },
    {
      "name": "기술레코드62",
      "language": {
        "name": "ko",
        "url": "/api/v2/language/3/"
      }
    },
    {
      "name": "招式紀錄６２",
      "language": {
        "name": "zh-hant",
        "url": "/api/v2/language/4/"
      }
    },
    {
      "name": "DT62",
      "language": {
        "name": "fr",
        "url": "/api/v2/language/5/"
      }
    },
    {
      "name": "TP62",
      "language": {
        "name": "de",
        "url": "/api/v2/language/6/"
      }
    },
    {
      "name": "DT62",
      "language": {
        "name": "es",
        "url": "/api/v2/language/7/"
      }
    },
    {
      "name": "DT62",
      "language": {
        "name": "it",
        "url": "/api/v2/language/8/"
      }
    },
    {
      "name": "TR62",
      "language": {
        "name": "en",
        "url": "/api/v2/language/9/"
      }
    },
    {
      "name": "わざレコード６２",
      "language": {
        "name": "ja",
        "url": "/api/v2/language/11/"
      }
    },
    {
      "name": "招式记录６２",
      "language": {
        "name": "zh-hans",
        "url": "/api/v2/language/12/"
      }
    },
    {
      "name": "DT62",
      "language": {
        "name": "es-419",
        "url": "/api/v2/language/14/"
      }
    }
  ],
  "held_by_pokemon": [],
  "sprites": {
    "default": "https://raw.githubusercontent.com/PokeAPI/sprites/master/sprites/items/tr62.png"
  },
  "baby_trigger_for": null,
  "machines": [
    {
      "machine": {
        "url": "/api/v2/machine/1761/"
      },
      "version_group": {
        "name": "sword-shield",
        "url": "/api/v2/version-group/20/"
      }
    }
  ]
}