{
  "id": 1818,
  "name": "shuppet-scrap",
  "fling_power": null,
  "fling_effect": null,
  "attributes": [],
  "category": {
    "name": "tm-materials",
    "url": "/api/v2/item-category/54/"
  },
  "effect_entries": [],
  "flavor_text_entries": [],
  "game_indices": [
    {
      "game_index": 2012,
      "generation": {
        "name": "generation-ix",
        "url": "/api/v2/generation/9/"
      }
    }
  ],
  "prices": [],
  "names": [
    {
      "name": "カゲボウズのきれはし",
      "language": {
        "name": "ja-hrkt",
        "url": "/api/v2/language/1/"
      }
    },
    {
      "name": "어둠대신의천조각",
      "language": {
        "name": "ko",
        "url": "/api/v2/language/3/"
      }
    },
    {
      "name": "怨影娃娃的殘片",
      "language": {
        "name": "zh-hant",
        "url": "/api/v2/language/4/"
      }
    },
    {
      "name": "Tissu de Polichombr",
      "language": {
        "name": "fr",
        "url": "/api/v2/language/5/"
      }
    },
    {
      "name": "Shuppet-Fetzen",
      "language": {
        "name": "de",
        "url": "/api/v2/language/6/"
      }
    },
    {
      "name": "Retal de Shuppet",
      "language": {
        "name": "es",
        "url": "/api/v2/language/7/"
      }
    },
    {
      "name": "Brandello di Shuppet",
      "language": {
        "name": "it",
        "url": "/api/v2/language/8/"
      }
    },
    {
      "name": "Shuppet Scrap",
      "language": {
        "name": "en",
        "url": "/api/v2/language/9/"
      }
    },
    {
      "name": "カゲボウズのきれはし",
      "language": {
        "name": "ja",
        "url": "/api/v2/language/11/"
      }
    },
    {
      "name": "怨影娃娃的残片",
      "language": {
        "name": "zh-hans",
        "url": "/api/v2/language/12/"
      }
    }
  ],
  "held_by_pokemon": [],
  "sprites": {
    "default": "https://raw.githubusercontent.com/PokeAPI/sprites/master/sprites/items/shuppet-scrap.png"
  },
  "baby_trigger_for": null,
  "machines": []
}