{
  "id": 1933,
  "name": "glimmet-crystal",
  "fling_power": null,
  "fling_effect": null,
  "attributes": [],
  "category": {
    "name": "tm-materials",
    "url": "/api/v2/item-category/54/"
  },
  "effect_entries": [],
  "flavor_text_entries": [],
  "game_indices": [
    {
      "game_index": 2132,
      "generation": {
        "name": "generation-ix",
        "url": "/api/v2/generation/9/"
      }
    }
  ],
  "prices": [],
  "names": [
    {
      "name": "キラーメのけっしょう",
      "language": {
        "name": "ja-hrkt",
        "url": "/api/v2/language/1/"
      }
    },
    {
      "name": "초롱순의결정",
      "language": {
        "name": "ko",
        "url": "/api/v2/language/3/"
      }
    },
    {
      "name": "晶光芽的結晶",
      "language": {
        "name": "zh-hant",
        "url": "/api/v2/language/4/"
      }
    },
    {
      "name": "Cristal de Germéclat",
      "language": {
        "name": "fr",
        "url": "/api/v2/language/5/"
      }
    },
    {
      "name": "Lumispross-Kristall",
      "language": {
        "name": "de",
        "url": "/api/v2/language/6/"
      }
    },
    {
      "name": "Cristal de Glimmet",
      "language": {
        "name": "es",
        "url": "/api/v2/language/7/"
      }
    },
    {
      "name": "Cristallo di Glimmet",
      "language": {
        "name": "it",
        "url": "/api/v2/language/8/"
      }
    },
    {
      "name": "Glimmet Crystal",
      "language": {
        "name": "en",
        "url": "/api/v2/language/9/"
      }
    },
    {
      "name": "キラーメのけっしょう",
      "language": {
        "name": "ja",
        "url": "/api/v2/language/11/"
      }
    },
    {
      "name": "晶光芽的结晶",
      "language": {
        "name": "zh-hans",
        "url": "/api/v2/language/12/"
      }
    }
  ],
  "held_by_pokemon": [],
  "sprites": {
    "default": "https://raw.githubusercontent.com/PokeAPI/sprites/master/sprites/items/glimmet-crystal.png"
  },
  "baby_trigger_for": null,
  "machines": []
}